{
  "protocol": "rogex-wsp",
  "version": "0.1",
  "defines": {
    "NOSTALGIA": {
      "components": ["RECORDAR", "ANTES", "DESEAR", "OTRO"],
      "es": "nostalgia",
      "en": "nostalgia",
      "article_es": "la",
      "emotion": { "valence": -0.3, "arousal": 0.3, "certainty": 0.6, "bond": 0.7 }
    }
  },
  "packets": [
    {
      "symbol": {
        "source": "YO",
        "relation": "SER",
        "target": "NOSTALGIA",
        "time": "AHORA"
      },
      "emotion": {
        "valence": -0.3,
        "arousal": 0.3,
        "dominance": 0.0,
        "certainty": 0.6,
        "urgency": 0.0,
        "bond": 0.7
      },
      "meta": {
        "note": "Ejemplo de generatividad por el cable: el mensaje transporta la definición de un concepto que el receptor no conoce. Al decodificarlo, NOSTALGIA queda registrada y puede reutilizarse."
      }
    }
  ]
}
